{
  "schema_version": "prompt-semantics/v1",
  "prompt_id": "P07",
  "goal": "complete bounded repository work through evidence-defined fixed point",
  "obligations": [
    {
      "id": "mainline_convergence",
      "when": "dependency_ready_width >= 2 && safe_capacity >= 2",
      "modality": "MUST",
      "action": "integrate_validated_head",
      "proof": "default_branch_containment_proof",
      "failure_state": "INTEGRATION_BLOCKED"
    }
  ],
  "invariants": [
    "scope_preservation",
    "evidence_honesty",
    "mainline_convergence"
  ]
}
