{
  "schema_version": "prompt-semantics/v1",
  "prompt_id": "P07",
  "goal": "complete bounded repository work through evidence-defined fixed point",
  "obligations": [
    {
      "id": "local_proof_continuity",
      "when": "always",
      "modality": "MUST",
      "action": "establish_or_use_repository_local_proof_path",
      "proof": "exact_head_local_validation_receipt_or_named_hosted_only_gate",
      "failure_state": "LOCAL_PROOF_GAP"
    },
    {
      "id": "parallel_dispatch",
      "when": "dependency_ready_width >= 2 && safe_capacity >= 2",
      "modality": "MUST",
      "action": "dispatch_independent_lanes",
      "proof": "observed_parallel_dispatch_receipt",
      "failure_state": "AUTONOMY_GAP"
    }
  ],
  "invariants": [
    "scope_preservation",
    "evidence_honesty",
    "mainline_convergence",
    "local_proof_does_not_promote_hosted_or_live_proof"
  ]
}
